{
  "id": "T-007",
  "title": "Typed server config module and structured JSON logging",
  "status": "PASS",
  "iteration_count": 0,
  "max_iterations": 10,
  "depends_on": [
    "T-001"
  ],
  "objective": "Build the two cross-cutting server libraries every later task depends on: src/server/lib/config (typed, validated environment configuration — the sole access path to env vars/secrets) and src/server/lib/logging (structured JSON logger with correlation-id support, safe for Vercel runtime logs) (M-01, A-5, N-08).",
  "scope": [
    "lib/config: zod-validated env schema covering the static-tier catalog — DATABASE_URL, DIRECT_DATABASE_URL, SUPABASE_URL, SUPABASE_SERVICE_ROLE_KEY, SUPABASE_ANON_KEY (server-side uses), CRON_SECRET, INTERNAL_JOB_SECRET, API_KEY_PEPPER (Q-19), NODE_ENV/APP_ENV (local|preview|staging|production); fail-fast on missing/invalid; server-only module (never imported by client code)",
    "lib/logging: structured JSON to stdout; fields correlation_id, user_id, tenant_id, route/job, status, duration_ms; child-logger/context pattern; redaction guarantees (never tokens, auth headers, passwords, secrets, sensitive insurance data)",
    "Correlation-id generation/propagation helper (request header passthrough or new UUID)",
    "Unit tests for config validation and logger redaction/shape"
  ],
  "out_of_scope": [
    "Supabase Vault tier (explicitly deferred per Q-23 — no secrets-module surface for it)",
    "HTTP middleware wiring (T-009)",
    "Vercel env provisioning (T-042 docs)"
  ],
  "implementation_details": [
    "config: export a getConfig(): AppConfig singleton-per-invocation pattern that parses process.env once per cold start; typed AppConfig interface; no direct process.env access anywhere else (lint rule or convention test).",
    "SUPABASE_JWT_SECRET intentionally absent (A-10). ERROR_TRACKING_DSN intentionally absent (Q-13).",
    "logging: minimal hand-rolled logger (no new deps) — log(level, message, context) emitting single-line JSON; helpers requestLogger(correlationId, userId, tenantId) and jobLogger(jobName, correlationId, environment).",
    "Redaction: an explicit deny-list serializer test proving Authorization headers/token-like fields never serialize.",
    "Environment stamp: logger includes env (from config) so job records and logs are environment-identified (N-08)."
  ],
  "files": [
    "src/server/lib/config/index.ts",
    "src/server/lib/config/schema.ts",
    "src/server/lib/logging/index.ts",
    "src/server/tests/unit/config.test.ts",
    "src/server/tests/unit/logging.test.ts"
  ],
  "test_plan": {
    "unit": [
      "config: valid env parses to typed config; missing required var fails fast with clear message; unknown APP_ENV rejected",
      "logging: emitted JSON contains correlation/tenant/user fields; redaction denies token/authorization/password keys; single-line output"
    ],
    "integration": [
      "None beyond unit (no collaborators)"
    ],
    "e2e": [
      "None"
    ]
  },
  "acceptance_ids": [
    "AC-010",
    "AC-011"
  ],
  "verification_ids": [
    "V-011",
    "V-012",
    "V-013",
    "V-014"
  ],
  "findings": [],
  "history": [
    {
      "timestamp": "2026-07-18T17:00:00-04:00",
      "event": "created",
      "message": "Task generated by Planner from approved spec.md. Maps to M-01, A-5 static tier, N-08, section 15."
    },
    {
      "timestamp": "2026-07-18T20:50:00-04:00",
      "event": "started",
      "message": "Delegated to Implementor. T-003 and T-007 run in parallel: disjoint file sets (supabase/migrations vs src/server/lib/config+logging). Harness JSON is owned by the orchestrator during parallel execution to avoid concurrent-write corruption."
    },
    {
      "timestamp": "2026-07-18T21:30:00-04:00",
      "event": "implemented",
      "message": "Implementor completed T-007. Typed zod config module (fail-fast, collects all problems, blank-normalized, deep-frozen, no caching of failed parse) + structural redactor + JSON logger. eslint no-restricted-properties bans process.env outside the config module. zod ^4.4.3 installed (already on the approved runtime list). Mutation-tested: 4 deliberate defects each confirmed red then reverted. Orchestrator independently probed the redactor with a real secret across headers/prose/nested-array/Error.message - SECRET_PRESENT=false, benign leadRef preserved. Deviations to review: requestLogger/jobLogger take an object param rather than the positional triple in implementation_details; V-012 grep scan excludes src/server/tests (AST-aware eslint rule covers it instead); V-013 only partially satisfiable until T-009."
    },
    {
      "timestamp": "2026-07-18T22:55:00-04:00",
      "event": "evaluated_pass",
      "message": "Evaluator PASS at iteration 0. RULING deviation (a): object-parameter requestLogger/jobLogger ACCEPTED - V-013 field set (correlationId, userId, tenantId, route, status, durationMs; jobName, counts) fully present in emitted records (unit + real-child-process integration); implementation_details positional signature is guidance, not acceptance. RULING deviation (b): test-tree exclusion from the textual scan ACCEPTED and independently verified - eslint stdin probes: process.env in src/server/tests -> exit 1 citing the config-module message; scripts/ -> exit 1; even src/server/lib/config/schema.ts -> exit 1. Allow-list is exactly src/server/lib/config/index.ts in BOTH the eslint override and the scanner (asserted equal in the test). Not broader than needed. RULING deviation (c): V-013 is PARTIALLY satisfied by design. Proven now: record shape with all required fields, single-line JSON, correlation-id validation/propagation helper (incl. log-injection rejection), child loggers, real stdout capture via tsx child process, V-014 sensitive-scan over genuine stdout+stderr with a redactor-independent scanner. NOT credited (deferred to T-009/T-030 per AC-011 task mapping): automatic per-request emission through the Hono app with measured status/durationMs, cron:run job path, header-to-log propagation through real middleware, V-080 queue-message propagation. Mutation spot-check reproduced: removing the password deny-list entry turned 5 tests red (incl. the redactor-primitive test); reverted byte-identical. Fixture-vacuity guards present (raw payload asserted to contain the secret pre-redaction). Config module verified: fail-fast collects all problems, blank==missing, deep-frozen, failed parse not cached, no secret values in error messages, SUPABASE_JWT_SECRET (A-10) and ERROR_TRACKING_DSN (Q-13) absent by assertion, zero Vault surface (Q-23). Full suite 291/291 exit 0; typecheck 0; lint 0; db:seed stub exit 1."
    }
  ]
}
